El gato no nos acaricia, se acaricia contra nosotros
Cuidado, he visto el coche de la policia
Viene alguien, poneos las mascarillas
Se que uno de vosotros tiene coronavirus. A ver si descubris al infectado
El jueves paellada en el fronton
Mi gato se llama guantes
El aliento de mi gato huele a comida de gato
Soy como una vela. Si te olvidas de mi, te quemare la casa
Siete mil millones de personas en el planeta y me toca estar con esta gente
Hoy ya he quemado mas de mil calorias. Otro dia, intentare sacar la pizza a tiempo del horno
El martes que viene comida popular en el fronton
Voy a organizar una fiesta este fin de semana, por si quereis venir
Me gustan los perros. Sobretodo a la brasa con salsa barbacoa
