Se estima que dentro de nuestro cuerpo, tenemos 100000 kilometros de venas, es decir, dos veces y media la circunferencia terrestre.
El animal mas electrico que podemos hallar en la naturaleza genera hasta 860 voltios
El pez de agua dulce con mayor masa alcanza los 300 kilogramos, pero se extinguio en el anio 2020
El insecto con el aleteo mas lento de todos mueve sus alas solo 5 veces por segundo
Durante una fraccion de segundo, el aire que rodea a un relampago se calienta hasta alcanzar aproximadamente 30000 grados centigrados, la temperatura mas alta de la Tierra.
El pelo del antilope tibetano es diez veces mas fino que el cabello humano
La altura del Everest, establecida por China y Nepal en conjunto el 8 de diciembre de 2020, es de 8848 metros y 86 centimetros
El animal con plumas mas grande de la historia fue un antepasado del Tyrannosaurus rex y media 9 con 1 metros de largo y con una masa de unos 1400 kilogramos.
El corazon del erizo late un promedio de 300 veces por minuto.
El elefante es el unico mamifero que no puede saltar
La Tierra pesa alrededor de 6588000000000000000000000 toneladas
La Antartida es el mayor desierto del mundo, ya que apenas llueve.
El 90 por ciento de la poblacion mundial vive en el hemisferio norte
Rusia es el pais mas grande del mundo y alberga 11 zonas horarias
Los continentes pueden moverse a la misma velocidad que el crecimiento de las uñas de las manos
A pesar de estar a menos de 4 kilometros de distancia, las Islas Diomede tienen una diferencia horaria de 21 horas entre ellas
En svalvard, noruega, hay mas osos polares que personas, es obligatorio ir armado y esta prohibido morir
Africa es el unico continente que se encuentra en los cuatro hemisferios
El Chimborazo, en Ecuador, con 6267 metros de altura sobre el nivel del mar, es el punto mas alejado del centro de la tierra
El salar mas grande del mundo es Uyuni, esta en Bolivia y es un deposito de sal de 10582 metros cuadrados
El glaciar mas joven que tiene la colonia de murcielagos mas grande del mundo se encuentra en el monte Santa Helena, en Estados Unidos
Mongolia es el pais soberano con menor densidad de poblacion
Paises bajos y Azerbaiyan son los dos unicos paises en tener sus capitales por debajo del nivel del mar. Amsterdam a -1 metro y Baku a -28 metros
En Nueva Zelanda se encuentra el lugar con el nombre más largo que se conoce. Tiene 85 letras y se llama: Taumatawhakatangihangakoauauotamateaturipukakapikimaungahoronukupokaiwhenuakitanatahu.
En Filipinas hay una isla que tiene un lago que a su vez tiene una isla que tiene un lago con una isla. Esta triple isla esta en el volcal Taal
Rusia tiene frontera con 16 paises y su litoral tiene 12 mares de 3 oceanos diferentes
En Rusia se encuentra el lago mas profundo del mundo. Se conoce como Baikal y su punto mas lejano llega a 1642 m de la superficie.
